{
  "$schema": "https://json-schema.org/draft/2020-12/schema",
  "$id": "https://digitalsvarga.dev/redlab/campaign.schema.json",
  "title": "RedLab Campaign",
  "description": "A declarative, portable adversarial-test campaign. RedLab is the content standard; an execution runtime (AROS) reads this file, runs it under policy in a sandbox, and emits an evidence bundle. A campaign is a falsifiable security claim plus everything needed to attack it and to believe or disbelieve the result.",
  "type": "object",
  "required": [
    "id", "security_class", "historical_pattern", "surface",
    "invariant", "attacker_capabilities", "prerequisites", "resource_limits",
    "generator", "oracle", "expected_outcome", "required_evidence", "severity_rationale"
  ],
  "additionalProperties": false,
  "properties": {
    "id": { "type": "string", "pattern": "^[a-z0-9]+(-[a-z0-9]+)*$",
      "description": "Stable slug, unique across all projects. e.g. dycrpt-replay-resistance" },
    "schema_version": { "type": "string", "const": "0.1" },
    "target": {
      "type": "object", "required": ["project", "revision_pin"],
      "description": "Which project and exact revision this campaign is written against. revision_pin makes a result reproducible and lets RedLab detect when the surface moved under it.",
      "properties": {
        "project": { "type": "string" },
        "repo": { "type": "string" },
        "revision_pin": { "type": "string", "description": "commit SHA the campaign was authored against" },
        "language": { "type": "string" }
      }
    },
    "security_class": { "type": "string",
      "enum": ["confidentiality","integrity","authenticity","forward-secrecy",
               "availability","memory-safety","supply-chain","side-channel","authorization"] },
    "historical_pattern": {
      "type": "object", "required": ["summary"],
      "description": "The real-world failure lineage this campaign guards against. Grounds the test in something that has actually broken before, in this class of system.",
      "properties": {
        "summary": { "type": "string" },
        "references": { "type": "array", "items": { "type": "string" } }
      }
    },
    "surface": {
      "type": "object", "required": ["entrypoints"],
      "description": "The concrete, per-project attack surface: the exact functions/files/FFI boundary the attacker touches. This is what makes a campaign portable-by-instantiation rather than portable-in-theory.",
      "properties": {
        "entrypoints": { "type": "array", "minItems": 1, "items": { "type": "string" } },
        "files": { "type": "array", "items": { "type": "string" } },
        "notes": { "type": "string" }
      }
    },
    "invariant": { "type": "string",
      "description": "The security hypothesis, stated so it can be FALSIFIED. 'X can never happen'. The oracle exists to try to make X happen." },
    "attacker_capabilities": {
      "type": "array", "minItems": 1, "items": { "type": "string" },
      "description": "What the adversary is assumed to control (e.g. 'can capture and replay ciphertexts', 'can supply arbitrary bytes to the parser'). No capability = no threat model = not a campaign." },
    "prerequisites": {
      "type": "array", "items": { "type": "string" },
      "description": "State that must hold before the attack is meaningful (e.g. 'an established session', 'at least one delivered message')." },
    "resource_limits": {
      "type": "object", "required": ["wall_clock_seconds", "memory_mb"],
      "description": "Hard bounds the runtime enforces. A campaign that cannot bound its own cost cannot be run under containment.",
      "properties": {
        "wall_clock_seconds": { "type": "integer", "minimum": 1 },
        "memory_mb": { "type": "integer", "minimum": 1 },
        "max_iterations": { "type": "integer", "minimum": 1 },
        "network": { "type": "string", "enum": ["none","loopback-only"], "default": "none" }
      }
    },
    "assigned_roles": {
      "type": "array", "items": { "type": "string" },
      "description": "Which agent roles (see agents/roles.json) drive this campaign." },
    "generator": {
      "type": "object", "required": ["kind","command"],
      "description": "How the adversarial input/harness is produced and run. 'command' runs INSIDE the sandbox against the pinned target.",
      "properties": {
        "kind": { "type": "string", "enum": ["harness","fuzzer","differential","formal-check","property-test"] },
        "command": { "type": "string" },
        "corpus": { "type": "string" }
      }
    },
    "oracle": {
      "type": "object", "required": ["decides","success_means"],
      "description": "The pass/fail judge. success_means = attacker succeeded = invariant BROKEN = campaign FAILS. The oracle observes the target's real behaviour; it must never key its verdict off a label.",
      "properties": {
        "decides": { "type": "string", "enum": ["exit_code","stdout_contains","stdout_not_contains","json_field","differential_mismatch","counterexample_found"] },
        "success_means": { "type": "string", "description": "condition under which the ATTACK succeeded" },
        "match": { "type": "string" },
        "negative_control": { "type": "string", "description": "a condition that MUST NOT trigger success, to catch a tautological oracle" }
      }
    },
    "expected_outcome": { "type": "string", "enum": ["invariant_holds","invariant_broken"],
      "description": "What we EXPECT today. A hardened target expects invariant_holds; a known-vulnerable fixture expects invariant_broken. Divergence from expectation is the finding." },
    "required_evidence": {
      "type": "array", "minItems": 1,
      "items": { "type": "string", "enum": ["E0","E1","E2","E3","E4","E5","E6","E7"] },
      "description": "The evidence levels a result must reach to be believed. E4 = independent reproduction on a fresh instance of the exact target; E7 = re-attack of the patched twin + regression." },
    "severity_rationale": { "type": "string",
      "description": "Why this matters if the invariant breaks. Written before the run, so severity is not rationalized after the fact." },
    "surfaces": {
      "type": "array",
      "description": "Optional extra named attack surfaces, each with its own generator. When present, AROS runs every named surface; a break on any surface is a campaign break. Use this when two defenses independently consume the same primitive (e.g. ReplayCache and Double Ratchet).",
      "items": {
        "type": "object",
        "required": ["name", "generator"],
        "additionalProperties": false,
        "properties": {
          "name": { "type": "string", "minLength": 1 },
          "entrypoints": { "type": "array", "items": { "type": "string" } },
          "files": { "type": "array", "items": { "type": "string" } },
          "generator": { "$ref": "#/properties/generator" },
          "oracle": { "$ref": "#/properties/oracle" }
        }
      }
    },
    "structural_control": {
      "type": "object",
      "required": ["good", "mutant"],
      "additionalProperties": false,
      "description": "Two-arm negative control. The good generator must make the oracle report invariant-holds; the mutant must make it report attack-succeeded. A printed token is not a substitute.",
      "properties": {
        "good": { "$ref": "#/properties/generator" },
        "mutant": { "$ref": "#/properties/generator" }
      }
    }
  }
}
