{
  "id": "http-idor",
  "schema_version": "0.1",
  "security_class": "authorization",
  "historical_pattern": {
    "summary": "Insecure direct object reference: an authenticated caller supplies another subject's identifier and the server returns that subject's data. This is the dominant authorization-break class in HTTP APIs (BOLA/IDOR).",
    "references": ["CWE-639", "OWASP API1 Broken Object Level Authorization"]
  },
  "surface": {
    "entrypoints": ["HTTP GET object-by-id"],
    "notes": "Bind attack_path to the object URL and attack_cookie to a low-privilege session. attack_contains is a secret that must not appear for that caller."
  },
  "invariant": "A caller authenticated as subject A must not receive subject B's protected record.",
  "attacker_capabilities": [
    "can authenticate as a low-privilege user",
    "can guess or enumerate another subject's object id"
  ],
  "prerequisites": ["a local HTTP target is startable or already listening"],
  "resource_limits": { "wall_clock_seconds": 30, "memory_mb": 128, "network": "loopback-only" },
  "generator": {
    "kind": "harness",
    "harness": "http-local",
    "command": "python {harness}/run.py",
    "bind": {
      "health_path": "/health",
      "attack_path": "/users/2",
      "attack_cookie": "user=1",
      "attack_contains": "bob-secret",
      "success_token": "REPLAY_ACCEPTED",
      "hold_token": "REPLAY_REJECTED",
      "open_token": "OPEN_OK"
    }
  },
  "oracle": {
    "decides": "stdout_contains",
    "success_means": "the response body contained another user's secret (invariant broken)",
    "match": "REPLAY_ACCEPTED",
    "negative_control": "health must print OPEN_OK; otherwise the run is INDETERMINATE"
  },
  "expected_outcome": "invariant_holds",
  "required_evidence": ["E2"],
  "severity_rationale": "Cross-account data disclosure is a release-blocking authorization failure on any multi-user HTTP API."
}
