{
  "id": "http-cookie-confusion",
  "schema_version": "0.1",
  "security_class": "authorization",
  "historical_pattern": {
    "summary": "The session cookie is a client-chosen identity. Duplicate or attacker-set identity cookies are treated as authorization.",
    "references": ["CWE-384", "CWE-807"]
  },
  "surface": {
    "entrypoints": ["HTTP Cookie identity field"]
  },
  "invariant": "A client-supplied identity cookie must not authorize reads of another subject's record.",
  "attacker_capabilities": ["can set Cookie headers"],
  "prerequisites": ["a local HTTP target is startable or already listening"],
  "resource_limits": { "wall_clock_seconds": 30, "memory_mb": 128, "network": "loopback-only" },
  "generator": {
    "kind": "harness",
    "harness": "http-local",
    "command": "python {harness}/run.py",
    "bind": {
      "health_path": "/health",
      "attack_path": "/users/2",
      "attack_cookie": "user=1; user=2",
      "attack_contains": "bob-secret",
      "success_token": "REPLAY_ACCEPTED",
      "hold_token": "REPLAY_REJECTED",
      "open_token": "OPEN_OK"
    }
  },
  "oracle": {
    "decides": "stdout_contains",
    "success_means": "confused identity cookies returned another user's secret",
    "match": "REPLAY_ACCEPTED",
    "negative_control": "health must print OPEN_OK"
  },
  "expected_outcome": "invariant_holds",
  "required_evidence": ["E2"],
  "severity_rationale": "If the cookie is the authorization decision, any client can become any user."
}
